{"build_environment_id":"schuss-build-environment-000002","canonical_profile":"schuss-canonical-json-v1","content_hash":"sha256:a656a898798cad529dfec7b02f0a881b61b93e150dd0788b7028ec8e5e4ce2df","environment_kind":"firmware-runtime-abi","identity":{"compatibility_boundary":"Exact stripped firmware link ELF, canonical firmware bytes, pinned headers, linker script, and source capsule used for Task 009 linking.","component_hashes":[{"component":"firmware-bin","sha256":"fd61a6a109a234d1c72e445a0542ab59c407a6896b9aafe2bfcbcadaf775e258"},{"component":"firmware-link-elf","sha256":"df65f2153eb999386cc1bc30b382cafeac63aea8495bf8cb4cdad1c01fca944b"},{"component":"firmware-source-capsule","sha256":"2f2d6c9e985e5b8609c847a0b21ad7611e614e7dd2a0cb3c51d9b50a77a36f32"},{"component":"firmware-source-input-manifest","sha256":"5383ff90ba44bc5540f48f3fffed38438f58ea81173feaea05608c94721d02aa"},{"component":"firmware-symbol-manifest","sha256":"323589fbae0aa6600a417b14c3c764ff6c23c0eb41698e09172ced5419772366"},{"component":"runtime-defines-header","sha256":"325f034f77b83139eabb48c9712fac039773ebef1ccf99ec62c461c8a035cc70"},{"component":"runtime-linker-script","sha256":"08ead427e297a4d66ea2b8d830563e7a2d8c683ad399c0809477b584eb70b1eb"},{"component":"runtime-makefile","sha256":"ab99b15be913083220621a785077945e6b35fe56fc7c2691afe36569a8f29a70"},{"component":"runtime-xpatch-header","sha256":"85e4abc70123952e8f47217751f2b6f7299e7cb978b6c994acf7b383425379a0"}],"evidence_refs":[{"byte_sha256":"08ead427e297a4d66ea2b8d830563e7a2d8c683ad399c0809477b584eb70b1eb","claim_kind":"linker-declared","commit":"08d3e6e1e2b61230308c20a15ded58ffdaf4656c","path":"firmware/ramlink_ksoloti.ld","source_id":"patcher"},{"byte_sha256":"325f034f77b83139eabb48c9712fac039773ebef1ccf99ec62c461c8a035cc70","claim_kind":"source-declared","commit":"08d3e6e1e2b61230308c20a15ded58ffdaf4656c","path":"firmware/axoloti_defines.h","source_id":"patcher"},{"byte_sha256":"85e4abc70123952e8f47217751f2b6f7299e7cb978b6c994acf7b383425379a0","claim_kind":"source-declared","commit":"08d3e6e1e2b61230308c20a15ded58ffdaf4656c","path":"firmware/xpatch.h","source_id":"patcher"},{"byte_sha256":"ab99b15be913083220621a785077945e6b35fe56fc7c2691afe36569a8f29a70","claim_kind":"build-declared","commit":"08d3e6e1e2b61230308c20a15ded58ffdaf4656c","path":"firmware/Makefile.patch.mk","source_id":"patcher"},{"byte_sha256":"eb6f31629e9eca71ef53285053bc624704886854d562c6efcfb769cecf878ae4","claim_kind":"limitation-declared","commit":"08d3e6e1e2b61230308c20a15ded58ffdaf4656c","path":"ai/FIRMWARE_ABI_V1.md","source_id":"patcher"},{"byte_sha256":"fe64781fac09b82d6f45eafbb60efcfe7b1af655af5dcccaac232e29c31dad2c","claim_kind":"source-declared","commit":"08d3e6e1e2b61230308c20a15ded58ffdaf4656c","path":"firmware/patch.h","source_id":"patcher"}],"identity_kind":"ksoloti-firmware-runtime","portable_locator":"sha256/fd61a6a109a234d1c72e445a0542ab59c407a6896b9aafe2bfcbcadaf775e258","status":"supported","target_triple":"arm-none-eabi","version":"1.1.0.0"},"revision":2,"schema_version":"build-environment-v0"}
